{
  "format": "pigforge.level-content",
  "schemaVersion": 8,
  "contentVersion": "Level_15",
  "goalZone": {
    "min": [
      23.85109,
      -5.7648487,
      -2.5
    ],
    "max": [
      25.179214,
      -3.1085987,
      2.5
    ]
  },
  "bounds": {
    "min": [
      -21.237406,
      -36.35003,
      -30
    ],
    "max": [
      85.49521,
      47.645145,
      35
    ]
  },
  "cameraLimits": {"topLeft":[1.2,22.19],"size":[54.5,33.1]},
  "spawns": [],
  "props": [
    {"id":"background_jungle_01_set","x":0,"y":0,"z":0,"rotation":0,"scaleX":1,"scaleY":1},
    {"id":"GoalArea_01","x":24.515152,"y":-4.4367237,"z":0,"rotation":0,"scaleX":1,"scaleY":1,"triggers":[{"dx":0,"dy":0,"dz":0,"sizeX":1.328125,"sizeY":2.65625,"sizeZ":5,"rotation":0}]},
    {"id":"Background_Cloud_03_SET","x":29.294434,"y":8.190034,"z":15.785136,"rotation":0,"scaleX":1,"scaleY":1},
    {"id":"Background_Cloud_01_SET","x":-23.67267,"y":27.456562,"z":15.751725,"rotation":0,"scaleX":1,"scaleY":1},
    {"id":"Background_Cloud_03_SET","x":-51.8294,"y":20.440205,"z":15.583803,"rotation":0,"scaleX":1,"scaleY":1},
    {"id":"Background_Cloud_03_SET","x":-34.14115,"y":8.224913,"z":15.799625,"rotation":0,"scaleX":1,"scaleY":1},
    {"id":"Background_Cloud_03_SET","x":23.277514,"y":10.167976,"z":15.28783,"rotation":0,"scaleX":1,"scaleY":1},
    {"id":"Background_Cloud_01_SET","x":-57.84322,"y":24.606417,"z":15.381782,"rotation":0,"scaleX":1,"scaleY":1},
    {"id":"Background_Cloud_03_SET","x":-6.9417324,"y":18.82712,"z":15.536638,"rotation":0,"scaleX":1,"scaleY":1},
    {"id":"Background_Cloud_03_SET","x":57.390476,"y":10.223583,"z":15.57816,"rotation":0,"scaleX":1,"scaleY":1},
    {"id":"Grass_06","x":31.39719,"y":-4.6058264,"z":-5,"rotation":0.5265971,"scaleX":1,"scaleY":1},
    {"id":"Grass_04","x":36.244617,"y":0.30481243,"z":-5,"rotation":0.6661936,"scaleX":-1,"scaleY":1},
    {"id":"Bush_02","x":49.127266,"y":21.048824,"z":-5,"rotation":0.16304116,"scaleX":-1,"scaleY":1},
    {"id":"Grass_01","x":19.10246,"y":13.59604,"z":-5,"rotation":0,"scaleX":1,"scaleY":1},
    {"id":"Grass_05","x":36.60511,"y":17.259245,"z":-5,"rotation":0,"scaleX":1,"scaleY":1},
    {"id":"Grass_02","x":41.898426,"y":18.006151,"z":-5,"rotation":0.41820925,"scaleX":1,"scaleY":1},
    {"id":"Daisy_02","x":43.103077,"y":18.90044,"z":-5,"rotation":0,"scaleX":1,"scaleY":1},
    {"id":"Grass_05","x":21.423933,"y":14.11599,"z":-5,"rotation":0,"scaleX":1,"scaleY":1},
    {"id":"Shell_01","x":34.755383,"y":-7.648444,"z":-5,"rotation":0,"scaleX":-0.75,"scaleY":0.75},
    {"id":"Bottle_01","x":17.084368,"y":-6.6020575,"z":-5,"rotation":0,"scaleX":1,"scaleY":1},
    {"id":"Star_01","x":21.448341,"y":-7.3953047,"z":-5,"rotation":0,"scaleX":-0.75,"scaleY":0.75},
    {"id":"Shell_01","x":32.645164,"y":-7.49681,"z":-5,"rotation":0,"scaleX":1,"scaleY":1},
    {"id":"Star_01","x":34.022488,"y":-7.2567225,"z":-5,"rotation":0,"scaleX":1,"scaleY":1},
    {"id":"Grass_02","x":29.257835,"y":13.596588,"z":-5,"rotation":0.023680255,"scaleX":1,"scaleY":1},
    {"id":"Grass_01","x":35.102734,"y":16.682678,"z":-5,"rotation":6.261081,"scaleX":1,"scaleY":1},
    {"id":"Grass_03","x":13.427929,"y":0.25859547,"z":-5,"rotation":5.4012847,"scaleX":1,"scaleY":1},
    {"id":"Grass_05","x":19.782877,"y":-5.2066584,"z":-5,"rotation":6.0627294,"scaleX":1,"scaleY":1}
  ],
  "terrain": [
    {
      "position": [6.3619223,-0.16104102,0],
      "depth": 10,
      "collider": true,
      "fill": {"texture":"Ground_Rocks_Texture.png","color":[255,255,255,255],"tileOffset":[0,6.2],"tileSize":[5,5]},
      "curve": {
        "textures": [{"texture":"Ground_Grass_Texture.png","wrap":"clamp"},{"texture":"Ground_Rocks_Outline_Texture.png","wrap":"repeat"}],
        "uScale": 10,
        "splat1": [[0,80],[81,1],[83,1],[86,1],[90,1],[93,1],[97,1],[100,84]],
        "nodes": [[18.185093,-6.55455],[18.077759,-6.5492125],[17.554333,-6.5225725],[17.387577,-6.4678516],[17.084908,-6.49076],[16.044308,-6.5520105],[15.878655,-6.4440117],[14.774552,-6.4440117],[14.504859,-6.4980154],[13.762456,-6.421009],[13.072391,-6.4516783],[12.905065,-6.5236998],[12.162066,-6.414386],[11.964126,-6.523203],[11.024766,-6.546254],[10.807149,-6.4472437],[9.753102,-6.4472466],[8.784168,-6.500394],[8.039915,-6.4612885],[7.4701576,-6.5161963],[7.23343,-6.459983],[7.117489,-6.552023],[5.8212004,-6.4472485],[4.753969,-6.4261847],[4.513299,-6.4776897],[3.9106483,-6.485121],[3.7288256,-6.3947515],[3.1765976,-6.3944216],[3.0165825,-6.505744],[2.4254894,-6.4954767],[2.141323,-6.444315],[1.0663934,-6.517456],[0.81269693,-6.430687],[-0.24653578,-6.4419556],[-0.51134443,-6.499542],[-1.142376,-6.4419556],[-1.8973608,-6.44759],[-2.0599585,-6.5138006],[-2.5049276,-6.476198],[-2.5993283,-6.335616],[-2.3258128,-5.970107],[-2.139749,-5.972495],[-1.7348404,-5.6565228],[-2.0484176,-4.9087496],[-1.4067788,-3.7183397],[-1.7951436,-3.2684708],[-1.8795681,-2.7136693],[-1.5418696,-2.2071133],[-2.0845995,-2.1588674],[-2.205206,-1.7849817],[-1.8146486,-1.5196192],[-1.91575,-0.5547724],[-1.3609595,0.09651528],[-1.0967464,0.1900255],[-0.7281914,0.48749137],[-0.41039515,0.373447],[-0.05214405,0.43846273],[0.39410067,0.040459305],[0.77055454,0.860809],[1.1623368,1.226441],[1.6270204,1.2014967],[1.9809465,0.7474866],[2.189167,0.99668],[2.2848482,1.3880919],[2.6373844,1.7289598],[2.4685354,2.163145],[2.4917889,2.8441122],[2.9027205,2.9470937],[3.0762281,2.5612688],[3.2226734,2.503405],[3.891694,3.09182],[4.401231,2.5940106],[5.4716415,2.7058818],[5.954067,2.8264842],[6.207341,2.729999],[6.410557,2.3991854],[6.955103,1.9822347],[7.148073,1.523927],[6.627574,1.3347809],[7.111891,0.5590697],[7.5340147,0.07664053],[7.5060806,-0.5656067],[7.992855,-1.7251322],[8.8388605,-2.829756],[9.489567,-3.5677416],[10.370246,-4.1448326],[11.1855135,-4.6338634],[12.419522,-5.0911417],[13.527802,-5.394492],[15.009553,-5.554207],[21.664986,-5.5606985],[22.912197,-5.459915],[23.932678,-5.220546],[25.101227,-4.754964],[26.07439,-4.2378807],[26.824741,-3.7500575],[27.600758,-3.0914383],[28.351967,-2.2429473],[29.268166,-0.71603554],[29.47351,0.32399604],[29.791237,0.6894583],[29.571335,1.323623],[30.261604,1.4613408],[30.129967,2.4931114],[30.828453,2.7518318],[31.70913,2.6825764],[32.143066,2.920681],[32.444584,2.8241959],[32.866707,3.2221975],[33.491825,3.539374],[33.952168,3.3307438],[33.879803,3.0774696],[34.35017,2.53474],[35.03763,2.8121352],[35.387386,2.7638924],[35.869812,2.6915283],[35.826267,2.1822946],[36.72612,1.3407342],[36.955273,0.6050336],[36.967335,0.014061123],[37.196487,-0.39600146],[37.232666,-0.8904886],[37.1108,-1.2231658],[37.85758,-1.7365232],[38.098793,-2.677255],[38.502396,-2.2120633],[39.13601,-2.1827676],[39.461647,-2.4842844],[40.149105,-2.2913136],[40.25002,-3.5744426],[40.812443,-3.714472],[41.029533,-4.2089596],[41.065716,-4.679325],[40.738876,-4.9814024],[40.93305,-5.4029646],[41.053658,-6.114544],[41.351658,-6.2742014],[41.43815,-6.4612865],[40.901295,-6.5504255],[40.535,-6.424323],[39.82157,-6.4715405],[39.431595,-6.561775],[38.876415,-6.480629],[38.122105,-6.4261],[37.584454,-6.529681],[37.413235,-6.462453],[37.184044,-6.4646683],[37.026478,-6.5584917],[35.859173,-6.4715405],[34.70499,-6.4897165],[34.43458,-6.5477123],[33.961212,-6.5613565],[33.670773,-6.4864035],[33.105453,-6.4442806],[32.9634,-6.529681],[32.423847,-6.453369],[32.16938,-6.471545],[31.033714,-6.531],[30.851612,-6.4442806],[29.742867,-6.4261045],[28.860725,-6.5159216],[28.0979,-6.4261084],[27.977257,-6.4937677],[27.522339,-6.523697],[27.371513,-6.453373],[27.18534,-6.441845],[27.027092,-6.530999],[25.961864,-6.5378704],[25.789532,-6.453373],[24.735317,-6.4624615],[24.398624,-6.550147],[23.860996,-6.4719505],[23.471825,-6.4737434],[23.120289,-6.4523478],[22.608017,-6.547641],[22.46923,-6.444333],[22.196484,-6.4523478],[22.003345,-6.558486],[20.906338,-6.4523478],[19.807327,-6.460312],[19.440994,-6.5425425],[18.899792,-6.5404816],[18.604343,-6.46708],[18.284351,-6.5495863]],